{
  "id": "text-art-000032",
  "art": "[SKIP]",
  "art_type": "ansi_art",
  "charset_class": "ascii_7bit",
  "line_count": 1,
  "context_text": "Optional test: [SKIP]",
  "intended_meaning": "端末風のスキップ表示",
  "plain_text": "任意のテストが実行されず、スキップされたことを端末風に示している。",
  "emotion": ["neutral"],
  "tone": "technical_status",
  "possible_misreadings": ["失敗ではなくスキップであることを落とす", "装飾ではなく通常文字列としてだけ読む"],
  "display_requirements": {
    "monospace_required": true,
    "known_font_dependency": false,
    "preserve_line_breaks": true
  },
  "cultural_context": ["terminal_culture", "general_internet"],
  "source_type": "original",
  "license": "CC0-1.0",
  "review_status": "reviewed"
}
