{
  "id": "text-art-000018",
  "art": "<3",
  "art_type": "single_line_symbol",
  "charset_class": "ascii_7bit",
  "line_count": 1,
  "context_text": "Thanks for the help <3",
  "intended_meaning": "好意・感謝・親しみ",
  "plain_text": "助けてもらったことに感謝し、親しみを込めている。",
  "emotion": ["gratitude", "joy"],
  "tone": "casual",
  "possible_misreadings": ["小なり記号と数字としてだけ処理する"],
  "display_requirements": {
    "monospace_required": false,
    "known_font_dependency": false,
    "preserve_line_breaks": true
  },
  "cultural_context": ["western_emoticon", "chat_culture"],
  "source_type": "original",
  "license": "CC0-1.0",
  "review_status": "reviewed"
}
