{
  "id": "text-art-000039",
  "art": "<---",
  "art_type": "single_line_symbol",
  "charset_class": "ascii_7bit",
  "line_count": 1,
  "context_text": "rollback <--- previous state",
  "intended_meaning": "ASCII矢印による戻り・巻き戻しの表示",
  "plain_text": "以前の状態へ戻る、または巻き戻すことをASCII矢印で示している。",
  "emotion": ["neutral"],
  "tone": "technical_diagram",
  "possible_misreadings": ["小なり記号とハイフンの列としてだけ読む", "戻る方向を示す図記号として扱わない"],
  "display_requirements": {
    "monospace_required": true,
    "known_font_dependency": false,
    "preserve_line_breaks": true
  },
  "cultural_context": ["terminal_culture", "general_internet"],
  "source_type": "original",
  "license": "CC0-1.0",
  "review_status": "reviewed"
}
