{
  "id": "text-art-000007",
  "art": "XD",
  "art_type": "single_line_symbol",
  "charset_class": "ascii_7bit",
  "line_count": 1,
  "context_text": "That bug was ridiculous XD",
  "intended_meaning": "強い笑い・面白がり",
  "plain_text": "そのバグがばかばかしくて強く笑っている。",
  "emotion": ["humor", "joy"],
  "tone": "casual",
  "possible_misreadings": ["英字の略語としてだけ解釈する"],
  "display_requirements": {
    "monospace_required": false,
    "known_font_dependency": false,
    "preserve_line_breaks": true
  },
  "cultural_context": ["western_emoticon", "chat_culture"],
  "source_type": "original",
  "license": "CC0-1.0",
  "review_status": "reviewed"
}
