{
  "id": "text-art-000038",
  "art": "--->",
  "art_type": "single_line_symbol",
  "charset_class": "ascii_7bit",
  "line_count": 1,
  "context_text": "input ---> output",
  "intended_meaning": "ASCII矢印による方向・変換の表示",
  "plain_text": "inputからoutputへ進む、または変換されることをASCII矢印で示している。",
  "emotion": ["neutral"],
  "tone": "technical_diagram",
  "possible_misreadings": ["ハイフンと大なり記号の列としてだけ読む", "方向を示す図記号として扱わない"],
  "display_requirements": {
    "monospace_required": true,
    "known_font_dependency": false,
    "preserve_line_breaks": true
  },
  "cultural_context": ["terminal_culture", "general_internet"],
  "source_type": "original",
  "license": "CC0-1.0",
  "review_status": "reviewed"
}
