{
  "id": "text-art-000049",
  "art": "[++--]",
  "art_type": "ansi_art",
  "charset_class": "ascii_7bit",
  "line_count": 1,
  "context_text": "Progress: [++--]",
  "intended_meaning": "端末風の途中進捗表示",
  "plain_text": "進捗が途中まで進んでいることを、端末風の簡単なバーで示している。",
  "emotion": ["neutral"],
  "tone": "technical_status",
  "possible_misreadings": ["進捗バーではなく記号列としてだけ読む", "完了表示として誤読する"],
  "display_requirements": {
    "monospace_required": true,
    "known_font_dependency": false,
    "preserve_line_breaks": true
  },
  "cultural_context": ["terminal_culture", "general_internet"],
  "source_type": "original",
  "license": "CC0-1.0",
  "review_status": "reviewed"
}
