{
  "id": "text-art-000036",
  "art": "*** ALERT ***",
  "art_type": "ascii_7bit",
  "charset_class": "ascii_7bit",
  "line_count": 1,
  "context_text": "*** ALERT *** 設定を確認してください。",
  "intended_meaning": "ASCII装飾による注意喚起",
  "plain_text": "ALERTという注意喚起をASCII記号で強調している。",
  "emotion": ["neutral"],
  "tone": "technical_status",
  "possible_misreadings": ["星印を単なる装飾として無視する", "強い感情表現として過剰に読む"],
  "display_requirements": {
    "monospace_required": true,
    "known_font_dependency": false,
    "preserve_line_breaks": true
  },
  "cultural_context": ["bbs_culture", "terminal_culture", "general_internet"],
  "source_type": "original",
  "license": "CC0-1.0",
  "review_status": "reviewed"
}
