{
  "id": "text-art-000003",
  "art": ":-)",
  "art_type": "ascii_7bit",
  "charset_class": "ascii_7bit",
  "line_count": 1,
  "context_text": "Thanks :-)",
  "intended_meaning": "軽い笑顔・友好的な態度",
  "plain_text": "感謝しており、友好的な笑顔を添えている。",
  "emotion": ["joy"],
  "tone": "casual",
  "possible_misreadings": ["句読点や記号列としてだけ処理する"],
  "display_requirements": {
    "monospace_required": false,
    "known_font_dependency": false,
    "preserve_line_breaks": true
  },
  "cultural_context": ["western_emoticon", "chat_culture"],
  "source_type": "original",
  "license": "CC0-1.0",
  "review_status": "reviewed"
}
