{
  "id": "text-art-000054",
  "art": "O_o",
  "art_type": "ascii_7bit",
  "charset_class": "ascii_7bit",
  "line_count": 1,
  "context_text": "The backup job deleted itself overnight O_o",
  "intended_meaning": "戸惑いを伴う驚き",
  "plain_text": "想定外の出来事に驚きつつ、状況を飲み込めず戸惑っている。",
  "emotion": ["surprise", "confusion"],
  "tone": "soft_negative",
  "possible_misreadings": ["単なる記号の並びとして読む", "怒りの表現だと誤解する"],
  "display_requirements": {
    "monospace_required": false,
    "known_font_dependency": false,
    "preserve_line_breaks": true
  },
  "cultural_context": ["western_emoticon", "chat_culture"],
  "source_type": "original",
  "license": "CC0-1.0",
  "review_status": "reviewed"
}
