{
  "id": "text-art-000046",
  "art": "╔══════╗\n║ MENU ║\n╚══════╝",
  "art_type": "unicode_text_art",
  "charset_class": "unicode_text",
  "line_count": 3,
  "context_text": "メニュー枠を示す。\n╔══════╗\n║ MENU ║\n╚══════╝",
  "intended_meaning": "二重罫線文字で作ったメニュー枠",
  "plain_text": "二重罫線文字の箱で、MENUと書かれたメニュー枠を表している。",
  "emotion": ["neutral"],
  "tone": "technical_diagram",
  "possible_misreadings": ["文字幅が合わないと箱として崩れる", "単なる記号列として処理される"],
  "display_requirements": {
    "monospace_required": true,
    "known_font_dependency": false,
    "preserve_line_breaks": true
  },
  "cultural_context": ["terminal_culture", "general_internet"],
  "source_type": "original",
  "license": "CC0-1.0",
  "review_status": "reviewed"
}
